{
  "person_id": "PERSON-0002",
  "incident_id": "NEPAL-RASUWA-2026",
  "preferred_name": "Suman Thing Lama",
  "name_variants": ["Suman Thing Lama", "सुमन थिङ लामा"],
  "estimated_age": 32,
  "home_location": "Hetauda-6, Chowghada, Makwanpur",
  "identity_state": "UNRESOLVED",
  "current_status": "STATUS_UNKNOWN",
  "attribute_sources": {
    "preferred_name": ["RR-0003"],
    "estimated_age": ["RR-0003"],
    "home_location": ["RR-0003"]
  }
}
