{
  "person_id": "PERSON-0001",
  "incident_id": "NEPAL-RASUWA-2026",
  "preferred_name": "Suman Tamang",
  "name_variants": ["Suman Tamang", "सुमन तामाङ"],
  "estimated_age": null,
  "home_location": "Hetauda-6, Chowghada, Makwanpur",
  "identity_state": "UNRESOLVED",
  "current_status": "STATUS_UNKNOWN"
}
